{
  "contract_version": "v1",
  "request_id": "11111111-1111-1111-1111-111111111111",
  "feature": "recap",
  "created_at_utc": "2026-03-02T12:00:00Z",
  "spoiler_mode": "safe",
  "game_context": {
    "game_time": "4E 201, 17:20",
    "player_location": "Whiterun",
    "event_log": [
      {
        "t": "17:03",
        "kind": "quest",
        "text": "Spoke to Farengar and received a dragonstone objective."
      },
      {
        "t": "17:10",
        "kind": "location",
        "text": "Left Dragonsreach and prepared to travel."
      }
    ]
  },
  "client": {
    "client_kind": "skyrim-mod",
    "client_version": "0.1.0",
    "profile": "developer"
  }
}
